<?xml version="1.0" encoding="UTF-8"?>
<!DOCTYPE wdb_query>

<wdb_query 
	xmlns:xi="http://www.w3.org/2001/XInclude"
	xmlns:xsi="http://www.w3.org/2001/XMLSchema-instance"
	xsi:noNamespaceSchemaLocation="../etc/wdb_query.xsd">

	<connection>
		<database>wdb</database>
		<host>localhost</host>
		<port>5432</port>
		<user>vegardb</user>
	</connection>

	<wci>
		<begin>
			<user>vegardb</user>
		</begin>

		<read>
			<dataprovider>met.no eceps modification</dataprovider>
			<referencetime>2011-05-12 02:00:00+02</referencetime>
			<dataversion>0</dataversion>
		</read>
	</wci>
 
</wdb_query>